bg,bgm,charector,emotion,effect,who,talk
artroom_afternoon,cafe_de_swing,Eimi,Eimi_smile,happy,ei,เฮลโหลๆ เทสต์ๆ
,,,Eimi_XD,,,ได้ยินหนูใช่ไหมคะ ทุกๆคนน
,,,Eimi_smile2,,,สวัสดีค่า-- หนูชื่ออิทสึกิ เอมิค่ะ เป็นนักเรียนชั้นม.4 อยู่ชมรมบาสเกตบอลค่ะ
,,,Eimi_smile3,,,สิ่งที่ชอบที่สุดในโลกคือบาสเกตบอลค่ะ ไม่งั้นก็คงไม่เข้าชมรมบาสเกตบอลหรอกค่า—
,,,Eimi_0_0,question,,อ่าเร้?
,,,Eimi_o,,,ให้แนะนำตัวมากกว่านี้เหรอคะ? อย่ามัวแต่พูดถึงบาสเกตบอลอย่างเดียวสินะ อืมม...
,,Eimi02,Eimi02_smug2,laught,,ถ้าเรื่องอายุล่ะก็ ต้องขอบอกว่าอายุของผู้หญิงเป็นความลับนะคะ ฮะๆๆๆ
,,,Eimi02_smile,,,ส่วนสูงของเอมิคือ 150 cm ค่ะ...เอ๊ะ? 
,,,Eimi02_shock,surprise,,ตัวเตี้ยเกินไป ไม่น่าเล่นบาสไหวเหรอคะ?
,,Eimi,Eimi_bubu,,,บู่วๆ อย่าสบประมาทพลังของสาวตัวเล็กสิคะ ถึงเอมิจะตัวเล็กแต่เอมิก็มั่นใจว่าเอมิมีความสามารถไม่แพ้คนอื่นหรอกค่ะ!
,,,Eimi_calm,,,คุยเรื่องทั่วๆไปบ้างดีกว่าค่ะ ของกินที่เอมิชอบมีมากมายค่ะ
,,Eimi02,Eimi02_smile,,,เอมิไม่ค่อยเลือกกินค่ะ ถ้าเลือกกินก็เดี๋ยวตัวไม่สูงขึ้นสักที
,,,Eimi02_shock,panic1,,อะไรนะคะ!? ถึงไม่เลือกกินก็ไม่สูงอยู่ดี 
,,,Eimi02_meme02,down,,โอววว...พูดจาแทงใจดำเค้าแท้หนอ ทำร้ายจิตใจน้อยๆของเอมิได้ลงคอ... 
,,Eimi,Eimi_confident2,shine,,ทุกคนหัวเราะในวันที่เอมิเอาฮา ระวังจะเสียน้ำตาในวันที่เอมิสูงขึ้นนะคะ! 
,,,Eimi_panic,panic,,อะไรนะ? คงไม่มีวันนั้นเกิดขึ้นเหรอ โน่วววววว..... 
,,,Eimi_confident,,,ทุกคนจำไว้เลยนะคะ! เป้าหมายของเอมิคือการเข้าเป็นตัวจริงของชมรมบาสเกตบอลตั้งแต่ ม.4 ค่ะ
,,,Eimi_smile2,,,เส้นทางสู่การเป็นตัวจริงน่ะไม่ใช่เรื่องง่าย เพราะการฝึกของชมรมเป็นไปอย่างเข้มงวด แถมยังมีคนฝีมือดีในชมรมที่เป็นคู่แข่งของเอมิค่ะ
oppai1,,,Eimi_panic,panic,,เดี๋ยวนะ ทำไมจู่ๆข้างหลังเอมิมีรูปอะไรแปลกๆเด้งมาล่ะ? 
,,,Eimi_panic_shy,surprise,,นี่มัน...ว้ายๆๆๆๆ
,,,Eimi_shy_meme,,,อย่ามองนะคะ! 
,,,Eimi_cry_meme2,,,นี่มันเป็นเหตุการณ์น่าอายที่เกิดขึ้นค่ะ อย่าดูไปมากกว่านี้นะคะ 
artroom_afternoon,,Eimi02,Eimi02_onegai,down,,นี่มันอะไรกันคะตะกี้นี้
,,,Eimi02_smug3,,,อะแฮ่ม ถ้าอยากจะรู้ว่าเส้นทางสู่ความฝันของเอมิจะเป็นจริงหรือเปล่า 
,,,Eimi02_smile2,happy,,เชิญติดตามได้ในเกม The picture of Café au lait เลยค่า!