bg,bgm,charector,emotion,effect,who,talk,
school_gym_b,morning_talk,Eimi02,Eimi02_smile3,happy,ei,หนูชนะแล้วค่า,
,,,,,tk,.....,
,,,,,n,ผมพูดไม่ออกเพราะลูกสุดท้ายผมแพ้ด้วยวิธีการที่บ้าบอมากๆ,
,,,,,,ยัยเอมิแค่งัดมือขึ้นกะทันหันแล้วพอลูกลอยขึ้นเหนือแป้นพอดิบพอดีก็ลงแป้นอย่างเหมาะเจาะจนเกิดเป็นคะแนนตัดสิน,
,,,,,,โอกาสแก้ตัวครั้งสุดท้ายของผมพังทลายลงเพราะดวงล้วนๆ ,
,,,,,,จะบ้าตาย!,
,,,Eimi02_smug,,ei,รุ่นพี่จำได้ไหมคะว่าพวกเราสัญญาอะไรกันไว้?,
,,,,,tk,ลืมแล้ว -_-+,
,,,,,n,ผมตอบรับหน้าด้านๆทำให้เอมิถึงกับอ้าปากค้างใส่ผม,
,,,Eimi02_panic,panic,ei,ไหงลืมง่ายจังค้า ,
,,,,,tk,เพราะเธอผลักฉันแรงไป หัวฉันกระแทกพื้นเมื่อกี้เลยทำให้ฉันมึนๆจนลืมทุกอย่างไปน่ะ -_-,
,,,,,n,ผมพยายามโกหกเพื่อให้รอดตัว,
,,Eimi,Eimi_shy meme,,,แต่เอมิกระโดดขึ้นลงไปมาพร้อมกับหลับตาแน่นราวกับเธอไม่ยอมง่ายๆ,
,,,,,ei,อย่ามาแถใส่หนูนะค้า! ,
,,,,,tk,แถอะไร? เรื่องจริงทั้งนั้น ,
,,,Eimi_confident,shine,ei,ถึงรุ่นพี่จะลืมแต่หนูจำได้นะคะ ไม่รอดหรอกค่ะ ,
,,,,,tk,ชิ...ดันมาความจำดีตอนนี้ซะงั้น ,
,,,Eimi_confident2,laught,ei,ปกติหนูก็ความจำดีอยู่แล้วค่ะ โฮ่ๆๆ ,
,,,,,tk,ทั้งๆที่ปกติออกจะสมองทึบแท้ๆ ทำไมจู่ๆ IQ ถึงเพิ่มขึ้นกะทันหันกัน!?,
,,,Eimi_030_02,,ei,รุ่นพี่คะ ขนาดรุ่นพี่แพ้ รุ่นพี่ก็ยังด่าหนูได้อีกเหรอคะ? ,
,,,Eimi_meh,,n,เอมิทำหน้าเจื่อนๆใส่ผมหลังโดนผมว่าไปอีกครั้งหนึ่ง เอาจริงๆผมก็ไม่ได้จงใจจะด่าเธอหรอก แต่ความปากร้ายมันเป็นนิสัยโดยธรรมชาติของผมไปแล้วนี่น่ะสิ,
,,,,,,หลายคนตีตัวห่างจากผมเพราะนิสัยนี้ แต่เอมิเป็นไม่กี่คนที่ยังทนกับผมได้ ผมก็ไม่เข้าใจว่าเธอเห็นอะไรในตัวผม ถึงยังไม่หนีไปสักที,
,,,,,,.....,
,,,,,,อาจจะเป็นเรื่องดีก็ได้ที่ยัยนี่ไม่หนีไป ตั้งแต่อยู่กับยัยนี่ชีวิตผมก็มีมีเรื่องแปลกๆเกิดขึ้น ถึงจะปวดหัวแต่ก็มีสีสันดี,
,,,,,,ยอมสักครั้งก็ได้ ดูสิว่ายัยนี่จะขออะไรจากผม,
,,,,,,นี่ผมกำลังรู้สึกสนุกอยู่งั้นเหรอ? แปลกจริงๆ,
,,,,,tk,แล้วเธอจะขออะไรจากฉันล่ะ?,
,,,Eimi_o,,ei,อืมมม,
,,,,,tk,เตือนก่อนนะว่าถ้าเป็นอะไรแผลงๆไม่ทำให้นะ ,
,,,Eimi_serous,,ei,รีบดักเลยเหรอคะ?,
,,,,,tk,ฉันเดาไว้ล่วงหน้าเลยว่าเธอต้องขออะไรบ้าๆแน่ๆ ,
,,,,,n,สมองยัยนี่คงไม่มีทางคิดอะไรดีๆได้แน่ ผมแอบเดาไว้ล่วงหน้าเลย,
,,,Eimi_angry,,ei,ไม่มีทางหรอกค่ะที่เอมิจะขออะไรบ้าๆ ,
,,,,,n,เอมิทำหน้ามุ่ยใส่ผม,
,,,,,,ผมอาจจะมองยัยนี่ในแง่ร้ายเกินไปก็ได้ เธออาจจะขออะไรเล็กๆน้อยๆเพราะเธอก็ยังมีความเกรงใจผมในฐานะรุ่นพี่รุ่นน้อง,
,,,,,,บางทีผมก็ควรจะเชื่อในตัวเธอบ้าง...,
,,Eimi02,Eimi02_sawagashi,shine,ei,เอมิแค่กำลังคิดว่าระหว่าง ‘ให้วิ่งแก้ผ้ารอบโรงเรียนยี่สิบรอบ’ กับ ‘วิดพื้นด้วยลิ้นหนึ่งร้อยครั้ง’ อันไหนจะน่าสนุกกว่ากันอยู่พอดีเลยค่ะ ,
,,,,,tk,.....,
,,,Eimi02_tired,,ei,โชคดีนะคะที่รุ่นพี่ดักไว้ก่อน ไม่งั้นเอมิคงได้เห็นอะไรสนุกๆไปแล้ว ,
,,,,,n,ดีนะที่ดักเอาไว้ก่อน ยัยนี่คิดแต่อะไรแผลงๆจริงๆด้วย,
,,,,,tk,จะขออะไรก็ขอเรื่องที่มีเหตุผลหน่อย,
,,,Eimi02_wink,wakaru,ei,งั้นขอดูรูปที่รุ่นพี่ส่งประกวดได้ไหมคะ?,
,,,,,tk,เธอไม่เข้าใจใช่ไหมว่าเหตุผลมีความหมายว่าอะไร ,
,,,,,n,เอมิยังคงพ่นอะไรที่ไม่มีเหตุผลเหมือนเดิม งานที่ส่งไปแล้วจะเอากลับมาตอนนี้ได้ยังไง,
,,,,,,แสดงว่าที่ผมเคยบอกเธอไว้ว่ารูปผมถูกส่งไปประเมินแล้วจะไม่ได้เข้าหัวโล่งๆของยัยนี่เลยสินะ,
,,,Eimi02_bored,down,ei,ขออะไรก็ไม่ได้สักอย่าง รุ่นพี่ทาคากิใจร้าย ,
,,,,,tk,หา?,
,,Eimi,Eimi_030,angry,ei,รุ่นพี่หัวดื้อ ใจจืดใจดำ บู่วๆ ,
,,,,,n,เอมิทำท่าเป่าปากใส่ผมอีกรอบหนึ่ง ท่าทางกวนประสาทของเธอทำให้ผมรู้สึกหัวร้อนๆอีกครั้ง ,
,,,,,,ในฐานะคนแพ้เดิมพัน จะยอมเงียบสักครั้งก็ได้เพราะเห็นแก่คนชนะ ให้ตายสิ,
,,,Eimi_smile,,ei,รุ่นพี่อย่าทำหน้าบึ้งสิคะ ,
,,,,,tk,ใครทำหน้าบึ้ง?,
,,,Eimi_smug3,,ei,รุ่นพี่นี่ขี้งอนจังนะคะ ,
,,,,,tk,ฉันไม่ได้ขี้งอน ,
,,,Eimi_smug2,laught,n,คำพูดของผมทำให้เอมิหัวเราะคิกคักเบาๆ,
,,,,,,พอชนะเดิมพันทีก็ทำท่าเหมือนคนถือไพ่เหนือกว่า ยัยนี่ก็ดูออกง่ายจริงๆนะ,
,,,Eimi_smile2,,ei,เอมิคิดออกแล้วว่าจะให้รุ่นพี่ทำอะไร,
,,,,,tk,..........,
,,,Eimi_smile3,laught,ei,สัญญานะคะว่าจะไม่หนีและยอมทำตามแต่โดยดี ฮะๆๆ,
,,,,,n,เอมิเผยรอยยิ้มซุกซนให้ผม เสียงหัวเราะกังวานใสดังมาจากเธอ,
,,,,,,ผมเบือนหน้าจากเธอโดยไม่เข้าใจว่าทำไมตัวเองทำแบบนั้น ผมแค่รู้สึกว่าใบหน้าผมมันอุ่นๆขึ้นเลยหนีหน้าเธอโดยไม่รู้ตัว,
,,,,,tk,ไม่หนีหรอก,
,,,Eimi_smug2,,ei,แต่ตอนนี้ยังหนีหน้าเอมิอยู่เลยนี่คะ,zoom เอมิ
,,,,,n,เอมิเดินเข้ามาใกล้ผมด้วยใบหน้าอมยิ้ม ,
,,,,,tk,ฉันหนีก็ปกติ เธอสิแปลก,
,,,Eimi_0_0,question,ei,หา?,เอมิกลับขนาดปกติ
,,,,,tk,เมื่อกี้ตอนแย่งลูกบาสกัน พวกเราสองคนน่ะ...,
,,Eimi02_body_shy,Eimi02_0,,ei,เอ๊ะ...,
,,,,,tk,.....,
,,,Eimi02_normal,,ei,.....,
,,,,,n,พวกเราสองคนเงียบลงกะทันหันเพราะต่างฝ่ายต่างนึกขึ้นได้ว่าก่อนหน้านี้พวกเราสองคนอยู่ใกล้กันมากๆจนร่างกายแนบเข้าหากัน,
,,,,,,เอมิหน้าแดงแจ๋ไปหมด ผมเองก็น่าจะหน้าแดงเหมือนกันเพราะอุณหภูมิใบหน้าผมเริ่มสูงขึ้น,
,,,,,,ความเงียบปกคลุมโรงยิมอยู่นานหลายวินาทีก่อนที่คำพูดเก้ๆกังๆของเอมิจะทำลายโลกไร้เสียงลง,
,,,Eimi02_0,,ei,รุ่นพี่ทาคากิคะ,
,,,,,tk,อะไรเหรอ?,
,,,Eimi02_smile,,ei,พวกเรากลับไปวาดรูปกันไหมคะ?,
,,,,,n,แน่นอนว่าเอมิไม่ได้อยากวาดรูปหรอก เธอแค่ถามเพราะอยากจะเปลี่ยนประเด็นเพราะความเขินอายต่างหาก ผมที่อ่านบรรยากาศออกเลยตามน้ำเธอเพราะผมก็กำลังอายไม่แพ้เธอ,
,,,,,tk,กลับห้องศิลปะกันเถอะ,
,,,Eimi02_smile2,,ei,ค่ะ รุ่นพี่ ,
,,,,,n,เอมิตอบรับผมเบาๆ,