bg,bgm,charector,emotion,effect,who,talk,
school_gym_b,oshakai_no_junbi,Eimi,Eimi_smile,,n,ผมพบตัวเองอยู่ที่โรงยิมโดยมีเอมิยืนอยู่ข้างๆ,
,,,,,,ทำไมไปๆมาๆ พวกเราสองคนถึงมายืนใต้แป้นบาสกันนะ?,
,,,,,tk,ทำไมฉันต้องมาที่นี่ด้วย?,
,,,Eimi_smug2,,ei,ในเมื่อรุ่นพี่จะให้หนูวาดรูป หนูก็จะให้รุ่นพี่ได้ลองเล่นบาสค่ะ,
,,,,,n,ผมขมวดคิ้วเป็นผมกับข้อสรุปแปลกๆของเอมิ,
,,,,,tk,ทำไมฉันต้องเล่นบาสด้วย?,
,,,Eimi_wakaranai,down,ei,แล้วทำไมหนูต้องวาดรูปล่ะคะ?,
,,,,,tk,เพราะเธอเป็นสมาชิกสำรองของชมรมฉันไง -_-+,
,,,Eimi_panic_shy,panic,ei,หนูยังไม่ได้ตอบตกลงเลยนะคะ ,
,,,,,n,เอมิทำตาโตใส่ผมอีกครั้งพร้อมกับกระโดดเด้งไปเด้งมา,
,,,,,,ท่าทางดีดดิ้นของเธอทำให้ผมนึกขำในใจ,
,,,Eimi_smug,,ei,เพื่อเป็นการแลกเปลี่ยนกัน หนูก็เลยลากรุ่นพี่มาเล่นกับหนูในเรื่องที่หนูถนัดบ้างไงคะ,
,,,,,tk,ฉันไม่เคยบอกเลยนะคะว่าจะเล่นกับเธอ ,
,,,Eimi_smug2,,ei,รุ่นพี่ไม่ต้องบอกหนูหรอกค่ะ เพราะหนูเป็นคนบอกรุ่นพี่ให้ทำเอง ,
,,,,,tk,นี่เธอใช้มุกของฉันกับฉันเองอย่างงั้นเหรอ? 0_0”,
,,,Eimi_smug3,laught,ei,อย่าปฏิเสธความหวังดีของรุ่นน้องสิคะ เหอๆๆๆ,
,,,,,n,บทสนทนาของพวกเราดูเหมือนจะซ้ำรอยกับไม่กี่นาทีก่อนหน้านี้ที่พวกเราคุยกันในห้องชมรมศิลปะ แถมยังตบท้ายด้วยเสียงหัวเราะเหมือนกัน,
,,,,,,ต่างกันแค่บทบาทของเราสลับกันเท่านั้นเอง,
,,,,,tk,ถ้าฉันไม่เล่น เธอจะทำอะไรฉันได้?,
,,Eimi02,Eimi02_smile3,,ei,แหม... ,
,,,,,tk,อะไร?,
,,,Eimi02_smug2,,ei,รุ่นพี่กลัวแพ้งั้นเหรอคะเลยรีบปฏิเสธ? ,
,,,,,tk,เธอ!,
,,,,,n,รอยยิ้มยั่วยุและเสียงยียวนของเอมิทำให้หัวผมรู้สึกอุ่นๆขึ้นมากะทันหัน,
,,,,,,ผมทำริมฝีปากบิดไปบิดมาด้วยความไม่พอใจ,
,,,,,tk,ฉันไม่หลงไปกับการยั่วยุของเธอหรอก,
,,,Eimi02_memeEYE,,ei,แล้วจะลุกลี้ลุกลนไปทำไมกันคะ?,
,,,,,n,เอมิยังไม่หยุดยิ้มกริ่ม ทำให้ผมกัดฟันกับความกวนประสาทของเธอ,
,,,,,,ผมหันหน้ามองเธอขวับ,
,,,,,tk,ใครลุกลี้ลุกลนกัน?,
,,,Eimi02_smug3,,ei,รุ่นพี่ไงคะ ,
,,,,,n,เอมิยิ้มกว้างกว่าเดิม พร้อมกับส่งเสียงหัวเราะคิกคัก แค่เห็นเธอขำใส่ผม ความรู้สึกเคืองก็เข้ามาในใจผมมากขึ้นเรื่อยๆ ,
,,,,,,ทาคากิ...นายควรจะใจเย็นๆ อย่าหลงไปกับการยั่วยุที่ไร้ศิลปะของยัยนี่,
,,,,,,ผมพยายามทำให้ตัวเองสงบลงด้วยการท่องตอกย้ำตัวเองในใจ,
,,,,,,...ใจเย็นๆเข้าไว้ นายจะลงไปเล่นเกมที่อีกฝ่ายถนัดกว่าเพื่ออะไร?,
,,,,,,เกมที่มีแต่เสียเปรียบ แพ้ชนะไปก็ไม่ได้อะไรอีก...จะเล่นทำไม?,
,,,,,,ทาคากิ นายต้องใจเย็...,
,,,Eimi02_smug2,,ei,รุ่นพี่ทาคากิเป็นคนขี้ขลาดนี่เอง หนูเข้าใจแล้วค่า ,
,,,,,tk,.....,
,,,,,n,เสียงในใจสะดุดลงกะทันหันเมื่อเสียงร่าเริงของเอมิแทรกผ่านเข้ามา,
,,,,,,คำว่า ‘ขี้ขลาด’ ทำให้ผมเผลอกัดปากตัวเองโดยไม่รู้ตัว,
,,,Eimi02_memeEYE,,ei,ไม่สู้ก็ไม่ต้องแพ้ สมกับเป็นวิธีคิดของคนฉลาดแต่ขี้ขลาดเลยนะคะ,
,,,,,tk,......,
,,,,,n,เสียงในใจหายวูบไปแล้วเพราะเอมิรุกล้ำความคิดผมเข้ามาด้วยประโยคที่ตามมา,
,,,,,,คำว่า ‘ขี้ขลาด’ รุนแรงกับจิตใจผมมากพอจนทำให้ผมตาตั้งได้,
,,,Eimi02_smile2,laught,ei,รุ่นพี่ที่ดูเข้มๆแต่ขี้กลัวก็น่ารักดีนะคะ หนูไม่ว่ารุ่นพี่หรอกค่ะ ฮะๆๆๆๆๆๆ ,
,,,,,n,เสียงหัวเราะเยาะเย้ยของเอมิดังในหัวผมซ้ำไปซ้ำมาราวกับเสียงสะท้อนในห้องโถงขนาดใหญ่,
,,,,,,ความอดทนที่สั่งสมมายาวนานถูกเอมิถลุงจนแหลกเป็นชิ้นๆ,
,,,,,,ยัยนี่...,
,,,,,,ไม่ใจเย็นแล้วเฟ้ย!,
,,,,,tk,เอมิ...,
,,Eimi,Eimi_smile,question,ei,คะ?,
,,,,,tk,ยังรับคำท้าทันอยู่ใช่ไหม? ,
,,,Eimi_o,,n,เอมิดูประหลาดใจกับการตอบรับของผมอยู่สักพักก่อนที่เธอจะส่งยิ้มให้ผมด้วยความพึงพอใจ,
,,,Eimi_smile3,,,เธอคงไม่นึกว่าผมจะเล่นด้วย ,
,,,,,,ถึงจะผิดการจากการคำนวณของเธอ แต่เธอก็คงชอบใจกับตัวเลือกของผม ไม่งั้นเธอคงไม่ยิ้มกว้างออกมาหรอก,
,,,Eimi_smug,,ei,เตรียมใจโดนเล่นงานหรือยังคะ? ,
,,,,,tk,.........,
,,,Eimi_smug2,,ei,ขอร้องหนูให้ออมมือสิคะ หนูอาจจะยอมใช้พลังแค่ 50% ให้ ,
,,,,,tk,ไม่จำเป็น,
,,,Eimi_0.0,question,ei,หา?,
,,,,,n,เอมิอุทานกับคำตอบอันขึงขังจากผม,
,,,,,tk,เข้ามาด้วยพลัง 120% เลย ฉันพร้อมเสมอ -_-+,
,,,Eimi_confident2,,ei,เย่อหยิ่งเป็นสองเท่า จะผิดพลาดเป็นสองเท่านะคะ ,
,,,,,tk,ไม่รู้ล่ะ เข้ามาเลย! ,
,,,Eimi_kira,shine,ei,รับคำท้าค่ะ!,
,,,,,tk,เราจะตัดสินแพ้ชนะกันยังไง?,
,,,,,n,ผมถามเอมิเพื่อให้พวกเราเข้าใจตรงกันก่อน,
,,,,,,ถ้าไม่มีกติกาก็ยากจะตัดสินว่าใครเป็นฝ่ายชนะเดิมพัน,
,,Eimi02,Eimi02_smile,,ei,ใครชู้ตลูกบาสลงแป้นได้ก่อนสามครั้ง คนนั้นเป็นฝ่ายชนะเอาไหมคะ? ,
,,,,,tk,ก็ได้ เข้าใจง่ายดี,
,,,,,n,ผมพยักหน้าตอบรับเอมิ,
,,,Eimi02_smug,,ei,คนแพ้ต้องทำตามที่คนชนะขอทุกอย่างนะคะ รุ่นพี่ ,
,,,,,tk,ทำไมไปๆมาๆเดิมพันมันเริ่มสูงขึ้นเนี่ย? ,
,,,Eimi02_sawagashi,,ei,ยิ่งมีบทลงโทษ การต่อสู้ก็ยิ่งท้าทายไม่ใช่เหรอคะ? ,
,,,,,tk,เพราะเธอได้เปรียบก็เลยกล้าพูดล่ะสิ ,
,,,Eimi02_closeEYE,,ei,ไม่น่าจะได้เปรียบมากนะคะ รุ่นพี่ก็ตัวสูงกว่าหนู แถมหนูยังเป็นสาวน้อยบอบบางอีก,
,,,,,tk,ถ้าเธอกล้าเรียกตัวเองเป็นสาวน้อยบอบบาง พวกนักเล่นกล้ามก็คงเป็นกุลสตรีได้เหมือนกัน,
,,,Eimi02_panic,panic,ei,รุ่นพี่กัดหนูอีกแล้วค่า-- ,
,stop music,,,,n,เอมิอ้าปากค้างหลังจากโดนผมเสียดสี ,
,asa_no_nigiyaka_mura,,,,tk,เลิกพูดมากแล้วเข้ามาเล...,
,,Eimi,Eimi_confident2,aware,ei,ฮัดโชะ หนึ่งแต้ม ,
,,,,,n,เอมิไม่ทันปล่อยให้ผมพูดท้าทายจนจบด้วยซ้ำ เธอกระโดดชู้ตลูกข้ามหัวผมไปหน้าด้านๆ,
,,,,,,ลูกบาสสีส้มกระเด้งลงห่วงพอดิบพอดีก่อนที่มันจะตกตุบๆกับพื้นยิมเป็นสัญญาณว่าผมถูกเธอเล่นงานไปแล้วหนึ่งครั้ง,
,,,Eimi_smug,,ei,หวาวๆ ลงด้วยล่ะๆ,
,,,,,n,เอมิชู้ตลูกลงแล้วก็ปรบมือให้ตัวเองแปะๆๆ พลางทำหน้ายิ้มกวนๆไปด้วย,
,,,,,tk,ฉันยังไม่ทันตั้งตัวเลย เธอจะเริ่มแล้วงั้นเรอะ!? ,
,,,Eimi_kuanteen,,ei,รุ่นพี่พูดเองก่อนนี่คะว่าให้เข้ามาเลย,
,,,,,tk,ยังพูดไม่จบสักหน่อย ,
,,,Eimi_smug3,laught,ei,มัวแต่พูดมากเลยโดนเอาไปหนึ่งแต้มไงคะ ฮ่าๆๆๆ,
,,,,,n,เอมิหัวเราะใส่หน้าผมอย่างไม่ไว้หน้า ทำให้ผมรู้สึกหน้าร้อนๆขึ้นด้วยความขัดเคืองใจ,
,,,,,,ยัยนี่กวนประสาทผมเก่งจริงๆ!,
,,,,,,ลูกบาสสีส้มกลิ้งกลุกๆกลับมาข้างแทบเท้าผม เพราะมันอยู่ในตำแหน่งที่ได้เปรียบพอดี ผมเลยจะคว้ามันเข้ามาในมือเพื่อชิงการครองลูกในทันที,
,,,Eimi_confident,shine,ei,ช้าไปค่ะ! ,
,,,,,tk,เฮ้ย!,
,,,,,n,เอมิที่ยืนประจันหน้าผมพอดีรีบก้มตัวคว้าลูกเข้ามือ ด้วยความไวปานวอกของเธอทำให้มือผมจับได้แค่อากาศ ส่วนลูกบาสไปอยู่ในมือเอมิเป็นที่เรียบร้อย,
,,,,,tk,เพราะตัวเตี้ยเหมือนเม็ดถั่วก็เลยเร็วนี่เอง! ร้ายชะมัด,
,,,Eimi_cry meme3,down,ei,แง! หนูชนะความเร็วรุ่นพี่ รุ่นพี่ก็มาว่าหนูเตี้ย! ,
,,,,,n,เอมิงอแงใส่ผมหลังโดนผมถากถางใส่ ,
,,,,,,แน่นอนว่าผมไม่ยอมเสียลูกที่สองให้เธอง่ายๆเป็นอันขาด,
,,,,,tk,เธอได้ลูกไปแล้วแต่อย่าหวังว่าจะผ่านฉันไปได้ง่ายๆ ,
,,,Eimi_panic_shy,panic1,ei,บทพูดรุ่นพี่เริ่มเหมือนตัวประกอบในการ์ตูนกีฬาแล้วค่ะ,
,,,,,tk,อย่ามาหาว่าฉันเป็นตัวประกอบนะ! ,
,,,Eimi_panic,surprise,ei,ก็รุ่นพี่กัดหนู หนูเลยกัดตอบไงคะ!,
,,,,,n,เด็กสาวผมสีน้ำตาลหลับตาปี๋ก่อนที่เธอจะค่อยๆเปลี่ยนสีหน้า,
,,,Eimi_smug3,,,เอมิยิ้มกว้างราวกับเธอไม่คิดว่าตัวเองจะแพ้เลย ทั้งๆที่ส่วนสูงที่น้อยกว่านั้นเป็นข้อเสียเปรียบในกีฬาบาสและผมขวางระหว่างเธอกับแป้นพอดิบพอดี,
,,,,,,ผมอาจจะไม่มีทักษะเท่า แต่ถ้าวัดเรื่องส่วนสูงแล้วผมได้เปรียบกว่า,
,,,Eimi_smug,,ei,ถ้าผ่านไม่ได้ งั้นก็ไม่ต้องผ่านค่ะ ,
,,,,,tk,เธอว่าไงนะ?,
,,,Eimi_smile,Eimi-Ougi,ei,รุ่นพี่รู้จักเฟดอเวย์ไหมคะ? ,
,,,,,tk,เฮ้ย!,
,,,,Eimi-Ougi2,n,ผมตาตั้งเมื่อลืมนึกไปว่ามีวิธีแก้ทางผมที่ง่ายๆอยู่,
,,,,,,เอมิกระโดดถอยไปข้างหลังพร้อมกับชู้ตลูกไปด้วย ,
,,,,,,วิถีลูกที่สูงโค้งกว่าระยะมือผมทำให้ผมไม่มีทางหยุดมันได้ ไม่ช้าหลังจากนั้นลูกบาสสีส้มก็ลงห่วงในชั่วอึดใจต่อมา ทำให้เอมินำหน้าผมไปสองแต้ม,
,,,,,,เฟดอเวย์คือการทำแต้มโดยการกระโดดถอยไปข้างหลังแล้วชู้ต ทำให้ผู้เล่นของอีกฝ่ายไม่สามารถเข้ามาสกัดได้และน้ำหนักบวกทิศทางจะแม่นยำมาก จึงนิยมใช้ท่ากระโดนถอยหลังแล้วชู้ตเพื่อทำคะแนน,
,,,,,,ผมโดนยัยนี่เล่นเข้าให้แล้ว! ให้ตายสิ!,
,,,Eimi_smug2,,ei,โดนไปสองแต้มค่า ,
,,,,,tk,แสบนักนะเธอเนี่ย,
,,,Eimi_pero,shine,ei,แสบอะไรคะ? หนูก็เล่นตรงไปตรงมา ,
,,,,,tk,เธอออ! ,
,,,Eimi_smug3,laught,ei,เลิกส่งเสียงร้องแล้วเข้ามาเถอะค่ะ รุ่นพี่ยังไม่หมดโอกาสเอาคืนนะคะ ฮ่าๆๆๆ,
,stop music,,,,n,เพราะโดนเอมิหัวเราะใส่หน้า ความเลือดร้อนของผมเลยพุ่งทะยานเข้ามา,
,dotabata_happening,,,,,ขณะที่เอมิกำลังเก็บลูกบาสที่เด้งกลับมาเข้ามือ ผมที่หน้ามืดเพราะความแค้นก็กระโจนเข้าหาเอมิอย่างรวดเร็วไม่ต่างจากเร่งรถพุ่งชน,
,,,Eimi_panic,panic1,ei,กรี๊ดด! รุ่นพี่ใจเย็นก่อนค่า ,zoom หน้าเอมิ
,,,,,tk,ใครจะเย็นไหว!?,
,,,Eimi_hurt,,ei,เล่นบาสนะคะไม่ใช่ฆ่าแกงกัน ,
,,,,,tk,ฉันไม่ยอมแพ้เธอง่ายๆหรอก! ดูซะ!,
,,,,,n,เพราะว่าผมกระโจนเร็วเกินไปแถมเอมิยังยื่นขามาโดนเท้าผม ร่างผมเลยลอยขึ้นกลางอากาศในขณะที่แรงส่งจากเท้าผมยังพาลำตัวพุ่งเข้าหาเอมิ,
,,,Eimi_panic_shy,panic,ei,กรี๊ดดด!,
,,,,,tk,อ้ากก!,
,,,-,,n,ร่างของเราทั้งสองคนปะทะเข้าใส่กันแล้วพวกเราก็ล้มระเนระนาดทั้งคู่,
,,,,,,ต่างฝ่ายต่างกรีดร้องเสียงดังเมื่อร่างของผมร่วงลงตามแรงโน้มถ่วงแล้วล้มทับเอมิเต็มๆ,
,,,,,,แรงกระแทกที่เกิดขึ้นหลายตลบทำให้ผมรู้สึกมึนหัว ผมค่อยๆลืมตาขึ้นมาพร้อมกับพยายามเรียกสติตัวเองให้กลับมาเข้าที่,
,,,,,,ภาพที่ผมเห็นยังเบลอๆอยู่เพราะสายตาไม่ทันปรับตัว,
,,,,,,นี่มัน...อะไรกัน?,
,,,,,,เกิดอะไรขึ้น? เราควรจะทำอะไรก่อนดี?,
,,,,,,,
,,,,,,ทำอะไรก่อนดี?,
,,,,,,-	ขยับมือหาที่ยึดเกาะก่อน    => Scene A,
,stop music,,,,,-	ลืมตาขึ้นก่อน  => Scene B,